Top consultas,Cliques,Impressões,CTR,Posição
progressiva hidraliso é boa,0,2,0%,8.5
hidra liso progressiva de chuveiro funciona,0,1,0%,6
receita para alisar o cabelo definitiva com maizena,0,1,0%,7
hidraliso é bom,0,1,0%,10
alisamento natural com leite e maizena,0,1,0%,11
hidraliso reclame aqui,0,1,0%,11
melhores progressivas de chuveiro,0,1,0%,12
hidraliso funciona,0,1,0%,15
melhor progressiva de chuveiro,0,1,0%,34
maizena para alisar cabelo,0,1,0%,35
qual a melhor progressiva de chuveiro,0,1,0%,40